{
  "departmentCode": "NON_PRODUCTION-S15-ABSEZ-DEPT",
  "deploymentIntent": {
    "requiresInstitutionalAcceptance": true,
    "requiresOperationalActivation": true,
    "targetMaturityStatus": "DRAFT",
    "targetPublicAvailability": "UNDER_DEVELOPMENT"
  },
  "description": "Representative ABSEZ draft service pack for compiler verification. NON_PRODUCTION — not operational and not an approved launch order.",
  "institutionCode": "NON_PRODUCTION-S15-ABSEZ-INST",
  "packId": "non-production-absez-simple-registration",
  "packLabel": "NON_PRODUCTION",
  "packName": "ABSEZ Draft Simple Registration (Compiler Proof)",
  "packVersion": "1.0.0",
  "schemaVersion": "1.0.0",
  "services": [
    {
      "applicantCategories": ["INDIVIDUAL", "CITIZEN"],
      "authorityFunctions": [
        {
          "authorityActionType": "PREPARE",
          "functionCode": "TEMPLATE-AUTH-REGISTRATION-INTAKE",
          "isConsequential": false,
          "publicStageLabel": "Submit registration",
          "sequenceOrder": 1
        },
        {
          "authorityActionType": "VERIFY",
          "functionCode": "TEMPLATE-AUTH-REGISTRATION-VERIFY",
          "isConsequential": true,
          "publicStageLabel": "Confirm registration",
          "sequenceOrder": 2
        }
      ],
      "communications": [
        {
          "channel": "EMAIL",
          "communicationCode": "ABSEZ-REG-ACK",
          "templateCode": "TEMPLATE-ACKNOWLEDGMENT",
          "triggerStageKey": "intake"
        }
      ],
      "completenessReview": {
        "deficiencyNoticeTemplateCode": "TEMPLATE-DEFICIENCY-NOTICE",
        "enabled": true,
        "requiredEvidenceCodes": ["ABSEZ-ID-DOC"]
      },
      "dashboardIndicators": [
        {
          "indicatorCode": "ABSEZ-REG-PENDING",
          "label": "Pending registrations",
          "metricType": "QUEUE_DEPTH"
        }
      ],
      "decisionStages": [
        {
          "decisionActorFunctionCode": "TEMPLATE-AUTH-REGISTRATION-VERIFY",
          "requiresSecondApproval": false,
          "stageKey": "verify"
        }
      ],
      "dependencies": [],
      "description": "NON_PRODUCTION ABSEZ representative registration service for governed compilation.",
      "evidenceRequirements": [
        {
          "description": "Identity evidence placeholder",
          "evidenceCode": "ABSEZ-ID-DOC",
          "label": "Identity document",
          "required": true,
          "verificationCategory": "INTEGRITY"
        }
      ],
      "fees": [
        {
          "amount": 25,
          "currencyCode": "XCD",
          "feeCode": "ABSEZ-REG-FEE",
          "label": "Registration fee",
          "waivable": false
        }
      ],
      "forms": [
        {
          "formCode": "ABSEZ-REG-FORM",
          "formName": "Registration intake",
          "sections": [
            {
              "fields": [
                {
                  "fieldKey": "fullName",
                  "fieldType": "TEXT",
                  "label": "Full name",
                  "required": true
                }
              ],
              "label": "Applicant details",
              "sectionKey": "applicant"
            }
          ],
          "versionLabel": "1.0.0"
        }
      ],
      "issuance": {
        "issuanceFunctionCode": "TEMPLATE-AUTH-REGISTRATION-VERIFY",
        "issuanceStageKey": "issuance",
        "outputCodes": ["ABSEZ-REG-CONFIRMATION"]
      },
      "lifecycle": {
        "supportsRenewal": false
      },
      "outputs": [
        {
          "deliveryChannel": "PORTAL",
          "label": "Registration confirmation",
          "outputCode": "ABSEZ-REG-CONFIRMATION",
          "outputType": "CONFIRMATION"
        }
      ],
      "redress": [
        {
          "description": "Administrative review route",
          "label": "Administrative review",
          "routeCode": "ABSEZ-REG-REVIEW",
          "routeType": "ADMINISTRATIVE_REVIEW"
        }
      ],
      "serviceCode": "ABSEZ-SIMPLE-REGISTRATION",
      "serviceFamilyCode": "NON_PRODUCTION-S15-ABSEZ-FAMILY",
      "serviceName": "ABSEZ Draft Simple Registration",
      "serviceSlug": "absez-simple-registration",
      "serviceType": "REGISTRATION",
      "slaRules": [
        {
          "clockStartsAtStageKey": "intake",
          "label": "Registration decision SLA",
          "ruleCode": "ABSEZ-REG-SLA",
          "targetDays": 10
        }
      ],
      "workflowStages": [
        {
          "consequenceLevel": "INFORMATIONAL",
          "displayOrder": 1,
          "label": "Intake",
          "stageKey": "intake",
          "stepType": "INTAKE"
        },
        {
          "authorityActionType": "REVIEW",
          "authorityFunctionCode": "TEMPLATE-AUTH-REGISTRATION-INTAKE",
          "consequenceLevel": "ADMINISTRATIVE",
          "displayOrder": 2,
          "label": "Completeness review",
          "stageKey": "completeness",
          "stepType": "COMPLETENESS_REVIEW"
        },
        {
          "authorityActionType": "VERIFY",
          "authorityFunctionCode": "TEMPLATE-AUTH-REGISTRATION-VERIFY",
          "consequenceLevel": "CONSEQUENTIAL",
          "displayOrder": 3,
          "isDecisionStage": true,
          "label": "Verify registration",
          "stageKey": "verify",
          "stepType": "SUBSTANTIVE_REVIEW"
        },
        {
          "authorityActionType": "ISSUE",
          "authorityFunctionCode": "TEMPLATE-AUTH-REGISTRATION-VERIFY",
          "consequenceLevel": "CONSEQUENTIAL",
          "displayOrder": 4,
          "isIssuanceStage": true,
          "label": "Issue confirmation",
          "stageKey": "issuance",
          "stepType": "ISSUANCE_GATE"
        }
      ]
    }
  ]
}
